{
  "fixture_id": 9104,
  "startsAt": "2026-04-09T08:00:00.000Z",
  "last_updated": "2026-04-09T09:48:00.000Z",
  "league": {
    "id": 73,
    "name": "Copa do Brasil",
    "country": "Brazil",
    "season": 2026,
    "round": "Quarter-finals"
  },
  "teams": {
    "home": { "id": 21, "name": "Cruzeiro", "shortName": "CRU", "logo": "" },
    "away": { "id": 22, "name": "Vitoria", "shortName": "VIT", "logo": "" }
  },
  "score": { "home": 1, "away": 1 },
  "status": {
    "phase": "live",
    "short": "P",
    "long": "Penalty In Progress",
    "minute": 120,
    "isFinished": false
  },
  "event": { "type": "NONE", "message": "" },
  "impact": {
    "summary": "Penalty shootout: 3-2",
    "table": null,
    "competition": [
      "Cruzeiro 3-2 Vitoria on penalties",
      "Penalty shootout in progress",
      "Cruzeiro scores the next penalty to win",
      "L. Romero misses in the shootout"
    ],
    "biggestMovement": null,
    "momentum": { "home": 50, "away": 50 },
    "mode": "cup"
  },
  "statistics": {
    "available": true,
    "home": { "possession": 52, "shotsOnTarget": 7, "totalShots": 15, "corners": 6 },
    "away": { "possession": 48, "shotsOnTarget": 5, "totalShots": 11, "corners": 4 },
    "momentum": { "home": 50, "away": 50 },
    "insights": []
  },
  "league_context": { "available": false, "fixtures": [] },
  "metadata": {
    "tableImpactAvailable": false,
    "impactMode": "cup",
    "competitionFormat": "knockout_cup",
    "knockoutContext": {
      "type": "two_leg_aggregate",
      "round": "Quarter-finals"
    },
    "penaltyContext": {
      "available": true,
      "phase": "live",
      "home": 3,
      "away": 2,
      "homeTaken": 4,
      "awayTaken": 4,
      "nextKickTeam": { "name": "Cruzeiro", "id": 21, "side": "home" },
      "pressure": { "type": "score_to_win", "teamName": "Cruzeiro" },
      "latestKick": {
        "teamName": "Vitoria",
        "playerName": "L. Romero",
        "scored": false
      }
    },
    "scenario": {
      "familyId": "cruzeiro-vitoria-quarter-finals",
      "variantId": "penalties-live",
      "label": "Penalty shootout live"
    }
  }
}
