{
  "fixture_id": 9104,
  "startsAt": "2026-04-09T08:00:00.000Z",
  "last_updated": "2026-04-09T09:01:00.000Z",
  "league": {
    "id": 73,
    "name": "Copa do Brasil",
    "country": "Brazil",
    "season": 2026,
    "round": "Quarter-finals"
  },
  "teams": {
    "home": { "id": 21, "name": "Cruzeiro", "shortName": "CRU", "logo": "" },
    "away": { "id": 22, "name": "Vitoria", "shortName": "VIT", "logo": "" }
  },
  "score": { "home": 1, "away": 0 },
  "status": {
    "phase": "live",
    "short": "2H",
    "long": "Second Half",
    "minute": 61,
    "isFinished": false
  },
  "event": { "type": "NONE", "message": "" },
  "impact": {
    "summary": "Next goal would put a side through",
    "table": null,
    "competition": [
      "Cruzeiro 1-1 Vitoria on aggregate",
      "Aggregate score is level",
      "Next goal would put a side through"
    ],
    "biggestMovement": null,
    "momentum": { "home": 59, "away": 41 },
    "mode": "cup"
  },
  "statistics": {
    "available": true,
    "home": { "possession": 58, "shotsOnTarget": 4, "totalShots": 10, "corners": 5 },
    "away": { "possession": 42, "shotsOnTarget": 2, "totalShots": 7, "corners": 2 },
    "momentum": { "home": 59, "away": 41 },
    "insights": ["Cruzeiro is creating the better chances"]
  },
  "league_context": {
    "available": true,
    "round": "Quarter-finals",
    "selectionMode": "same-window",
    "totalFixtures": 3,
    "displayedFixtures": 3,
    "limited": false,
    "fixtures": [
      {
        "fixtureId": 9201,
        "startsAt": "2026-04-09T08:00:00.000Z",
        "timestamp": 1775721600,
        "status": { "phase": "live", "minute": 64 },
        "teams": {
          "home": { "name": "Flamengo", "shortName": "FLA", "logo": "" },
          "away": { "name": "Palmeiras", "shortName": "PAL", "logo": "" }
        },
        "score": { "home": 2, "away": 1 }
      },
      {
        "fixtureId": 9202,
        "startsAt": "2026-04-09T08:00:00.000Z",
        "timestamp": 1775721600,
        "status": { "phase": "live", "minute": 58 },
        "teams": {
          "home": { "name": "Sao Paulo", "shortName": "SAO", "logo": "" },
          "away": { "name": "Bahia", "shortName": "BAH", "logo": "" }
        },
        "score": { "home": 0, "away": 0 }
      },
      {
        "fixtureId": 9203,
        "startsAt": "2026-04-09T08:00:00.000Z",
        "timestamp": 1775721600,
        "status": { "phase": "live", "minute": 63 },
        "teams": {
          "home": { "name": "Fortaleza", "shortName": "FOR", "logo": "" },
          "away": { "name": "Atletico-MG", "shortName": "CAM", "logo": "" }
        },
        "score": { "home": 1, "away": 1 }
      }
    ]
  },
  "metadata": {
    "tableImpactAvailable": false,
    "impactMode": "cup",
    "competitionFormat": "knockout_cup",
    "knockoutContext": {
      "type": "two_leg_aggregate",
      "round": "Quarter-finals"
    },
    "scenario": {
      "familyId": "cruzeiro-vitoria-quarter-finals",
      "variantId": "aggregate-level",
      "label": "Aggregate level"
    }
  }
}
