{
  "fixture_id": 9104,
  "startsAt": "2026-04-09T08:00:00.000Z",
  "last_updated": "2026-04-08T20:15:00.000Z",
  "league": {
    "id": 73,
    "name": "Copa do Brasil",
    "country": "Brazil",
    "season": 2026,
    "round": "Quarter-finals"
  },
  "teams": {
    "home": { "id": 21, "name": "Cruzeiro", "shortName": "CRU", "logo": "" },
    "away": { "id": 22, "name": "Vitoria", "shortName": "VIT", "logo": "" }
  },
  "score": { "home": 0, "away": 0 },
  "status": {
    "phase": "upcoming",
    "short": "NS",
    "long": "Not Started",
    "minute": 0,
    "isFinished": false
  },
  "event": { "type": "NONE", "message": "" },
  "impact": {
    "summary": "Pre-match only - live table impact starts at kickoff",
    "table": null,
    "competition": ["Live table impact will start once the match kicks off."],
    "biggestMovement": null,
    "momentum": { "home": 50, "away": 50 },
    "mode": "cup"
  },
  "statistics": {
    "available": false,
    "home": null,
    "away": null,
    "momentum": { "home": 50, "away": 50 },
    "insights": []
  },
  "prematch": {
    "prediction": {
      "available": true,
      "winnerName": "Cruzeiro",
      "winOrDraw": true,
      "underOver": "-3.5",
      "advice": "Cruzeiro or draw and under 3.5 goals",
      "comparison": [
        { "key": "form", "home": "61%", "away": "39%" },
        { "key": "att", "home": "56%", "away": "44%" },
        { "key": "def", "home": "58%", "away": "42%" }
      ]
    },
    "lineups": {
      "available": true,
      "home": {
        "formation": "4-2-3-1",
        "coach": "Fernando Seabra",
        "colors": {
          "playerPrimary": "0038a8",
          "goalkeeperPrimary": "ffd34d"
        },
        "startXI": [
          { "name": "Anderson", "position": "G", "grid": "1:1" },
          { "name": "William", "position": "D", "grid": "2:4" },
          { "name": "Joao Marcelo", "position": "D", "grid": "2:3" },
          { "name": "Lucas Villalba", "position": "D", "grid": "2:2" },
          { "name": "Marlon", "position": "D", "grid": "2:1" },
          { "name": "Lucas Romero", "position": "M", "grid": "3:2" },
          { "name": "Ramiro", "position": "M", "grid": "3:1" },
          { "name": "Matheus Pereira", "position": "M", "grid": "4:3" },
          { "name": "Arthur Gomes", "position": "M", "grid": "4:2" },
          { "name": "Rafael Elias", "position": "M", "grid": "4:1" },
          { "name": "Juan Dinenno", "position": "F", "grid": "5:1" }
        ]
      },
      "away": {
        "formation": "4-3-3",
        "coach": "Thiago Carpini",
        "colors": {
          "playerPrimary": "d6001c",
          "goalkeeperPrimary": "111111"
        },
        "startXI": [
          { "name": "Lucas Arcanjo", "position": "G", "grid": "1:1" },
          { "name": "Raul Caceres", "position": "D", "grid": "2:4" },
          { "name": "Wagner Leonardo", "position": "D", "grid": "2:3" },
          { "name": "Camutanga", "position": "D", "grid": "2:2" },
          { "name": "Lucas Esteves", "position": "D", "grid": "2:1" },
          { "name": "Willian Oliveira", "position": "M", "grid": "3:3" },
          { "name": "Luan", "position": "M", "grid": "3:2" },
          { "name": "Matheusinho", "position": "M", "grid": "3:1" },
          { "name": "Osvaldo", "position": "F", "grid": "4:3" },
          { "name": "Alerrandro", "position": "F", "grid": "4:2" },
          { "name": "Iury Castilho", "position": "F", "grid": "4:1" }
        ]
      }
    },
    "injuries": {
      "available": true,
      "home": [{ "player": "Mateus Vital", "reason": "Muscle Injury" }],
      "away": [{ "player": "Dudu", "reason": "Knee Injury" }]
    }
  },
  "league_context": {
    "available": true,
    "round": "Quarter-finals",
    "selectionMode": "all",
    "totalFixtures": 3,
    "displayedFixtures": 3,
    "limited": false,
    "fixtures": [
      {
        "fixtureId": 9201,
        "startsAt": "2026-04-09T08:00:00.000Z",
        "timestamp": 1775721600,
        "status": { "phase": "upcoming", "minute": 0 },
        "teams": {
          "home": { "name": "Flamengo", "shortName": "FLA", "logo": "" },
          "away": { "name": "Palmeiras", "shortName": "PAL", "logo": "" }
        },
        "score": { "home": 0, "away": 0 }
      },
      {
        "fixtureId": 9202,
        "startsAt": "2026-04-09T10:30:00.000Z",
        "timestamp": 1775730600,
        "status": { "phase": "upcoming", "minute": 0 },
        "teams": {
          "home": { "name": "Sao Paulo", "shortName": "SAO", "logo": "" },
          "away": { "name": "Bahia", "shortName": "BAH", "logo": "" }
        },
        "score": { "home": 0, "away": 0 }
      },
      {
        "fixtureId": 9203,
        "startsAt": "2026-04-10T00:00:00.000Z",
        "timestamp": 1775779200,
        "status": { "phase": "upcoming", "minute": 0 },
        "teams": {
          "home": { "name": "Fortaleza", "shortName": "FOR", "logo": "" },
          "away": { "name": "Atletico-MG", "shortName": "CAM", "logo": "" }
        },
        "score": { "home": 0, "away": 0 }
      }
    ]
  },
  "metadata": {
    "tableImpactAvailable": false,
    "impactMode": "cup",
    "competitionFormat": "knockout_cup",
    "knockoutContext": {
      "type": "two_leg_aggregate",
      "round": "Quarter-finals"
    },
    "scenario": {
      "familyId": "cruzeiro-vitoria-quarter-finals",
      "variantId": "prematch",
      "label": "Pre-match with prediction"
    }
  }
}
